Corporate Decisions,740,/static/interpretations-and-precedents/sept/int740.pdf,"Letter advises the Bank as follows: 1) The question of whether ""salary"" as used in12 C.F.R. 2.4 includes an officer's base salary, bonuses, director's fees and/or anyother compensation paid by the Bank must be determined by the Bank'smanagement; 2) the question of whether the payment bonuses for credit life salesunder 12 C.F.R. 2.4 is based on salary received by the recipient in a calendar year,a fiscal year, or any 12-month period must be determined by the Bank'smanagement; and 3) pursuant to 12 C.F.R. 2.4, if the Bank's CEO is a loan officerand the CEO participates in the bonus plan under which payments based on creditlife insurance sales are made, the CEO must be included in averaging the salaries ofloan officers that participate in the Bank's bonus or incentive plan.  (08/19/96)"
Corporate Decisions,741,/static/interpretations-and-precedents/sept/int741.pdf,National bank may acquire majority interest in company which operates call centerfacility which operates programs by which potential customers for new or usedautomobiles may access databases containing information on the used and new carinventories of numerous automobile dealerships in its metropolitan area.  (08/19/96)
Corporate Decisions,742,/static/interpretations-and-precedents/sept/int742.pdf,"Letter to Apollo Trust Company confirming that a national bank subsidiary mayprovide home banking services via a direct and Internet connection to the bank'shome banking system and, incidental to that service, may also provide Internetaccess to customers and non-bank customers in the bank's service area. (08/19/96)"
Corporate Decisions,96-46,/static/interpretations-and-precedents/sept/corpde46.pdf,"Applications to merge Mellon Bank (MD), Rockville, Maryland, and Mellon PSFS(NJ), N.A., Voorhees Township, New Jersey, with and into Mellon Bank, N.A.,Pittsburgh, Pennsylvania; (Control Numbers 96NE020009 & 96NE020007), (08/20/96). "
Corporate Decisions,96-47,/static/interpretations-and-precedents/sept/corpde47.pdf,"Application to merge PNC Bank, National Association, Pittsburgh, Pennsylvania,with Midlantic Bank, National Association, Newark, New Jersey, under the charterof the latter and with the title PNC Bank, National Association; (Control Number96NE020022), (08/20/96)."
Approvals with conditions enforceable under 12 U.S.C. 1818,96-48,/static/interpretations-and-precedents/sept/corpde48.pdf,"Applications of Union Planters Bank, N.A., West Memphis, Arkansas, to changethe location of its main office to Memphis, Tennessee and establish a new branch atthe former location of its main office and then merge with and into Union PlantersNational Bank, Memphis, Tennessee; (Control Numbers 96SE070020, 96SE050010, &96SE020030), (08/28/96)."
Approvals with conditions enforceable under 12 U.S.C. 1818,96-49,/static/interpretations-and-precedents/sept/corpde49.pdf,"Application to merge Wells Fargo Bank of Arizona, N.A., Phoenix, Arizona, withand into Wells Fargo Bank, N.A., San Francisco, California; (Control Number96ML020017), (08/31/96)."
Interpretive Letters,213,/static/interpretations-and-precedents/sept/conap213.pdf,"Letter of intent and applications of AMCORE Trust Company, Rockford, Illinois,to convert to a national trust bank, acquire two operating subsidiaries, and reduce itsequity capital by $1,500,000 at the time of conversion.  (Control Numbers 96CE01031 &96CE12203), 08/21/96"
Interpretive Letters,214,/static/interpretations-and-precedents/sept/conap214.pdf,"Application to establish a new national bank, limited to trust powers, with the titleof Boston EquiServe Trust Company, National Association.  (Control Number96NE010013), 08/26/96"
Interpretive Letters,743,/static/interpretations-and-precedents/oct/int743.pdf,Letter confirming that a national bank may establish an operating subsidiary toreinsure a portion of the mortgage insurance on loans originated or purchased bythe parent bank or one of its affiliates.  (10/17/96)
Corporate Decisions,744,/static/interpretations-and-precedents/oct/int744.pdf,"Letter discusses whether prepayment penalties on Home Equity Loans are""interest"" under 12 U.S.C. 85. (08/21/96)"
Corporate Decisions,745,/static/interpretations-and-precedents/oct/int745.pdf,"Using three part test established for national bank's majority interest in acorporation, partnership, or limited liability company, approves national bankacquiring certificates of participating interest in Delaware business trust created tohold and manage the bank's investment portfolio. (08/26/96)"
Corporate Decisions,746,/static/interpretations-and-precedents/oct/cra746.pdf,"Letter discusses whether participation in a revolving loan program (RLP) would beviewed favorably for purposes of the Community Reinvestment Act regulations, 12C.F.R. part 25. (09/09/96)"
Corporate Decisions,747,/static/interpretations-and-precedents/oct/int747.html,Banks may not repurchase their shares from a shareholder's estate and hold themas treasury stock unless it would qualify as a reduction in capital under 12 U.S.C.59. (09/11/96)
Corporate Decisions,748,/static/interpretations-and-precedents/oct/int748.pdf,Enforceability of secured creditor and offset rights in the event of insolvency and areceivership of an uninsured federal branch of a foreign bank. (09/13/96)
Corporate Decisions,749,/static/interpretations-and-precedents/oct/int749.pdf,Letter discusses that section 24(Seventh) does preempt Texas insurance licensinglaws with respect to annuities sales by national banks to the extent that those lawsprevent or impair the ability of national banks to exercise their authority undersection 24(Seventh) to sell annuities. (09/13/96)
Corporate Decisions,750,/static/interpretations-and-precedents/oct/cra750.pdf,Letter discusses an investment in an organization that provides housing referral andassistance to low- and moderate-income individuals would receive positiveconsideration as a qualified investment for CRA purposes.  (09/23/96)
Corporate Decisions,751,/static/interpretations-and-precedents/oct/int751.pdf,National bank employees cannot disclose non-public OCC information withoutOCC approval.  (09/24/96)
Corporate Decisions,752,/static/interpretations-and-precedents/oct/int752.pdf,"Certain activities offered by a national bank in connection with a state lottery are not in violation of 12 USC 25a.  (09/26/96)
"
Corporate Decisions,96-50,/static/interpretations-and-precedents/oct/corpde50.pdf,"Application to merge First Community Bank, Lone Grove, Oklahoma into FirstNational Bank & Trust Company of Ardmore, Ardmore, Oklahoma; (ControlNumber 96SW020030),  (09/10/96). "
Corporate Decisions,96-51,/static/interpretations-and-precedents/oct/corpde51.pdf,"Application to merge The First National Bank of Enfield, Enfield, Illinois withand into The First National Bank of Carmi, Carmi, Illinois; (Control Number96CE020037),  (09/12/96)."
Corporate Decisions,96-52,/static/interpretations-and-precedents/oct/corpde52.pdf,"Notice of The First National Bank of Chicago, Chicago, Illinois, of intent toestablish an operating subsidiary that will sponsor a series of trusts that will holdgeneral obligation municipal bonds; (Control Number 95ML08008),  (09/20/96)."
Corporate Decisions,96-53,/static/interpretations-and-precedents/oct/corpde53.pdf,"Application of American National Bank & Trust Company, Danville, Virginia topurchase certain of the assets and assume all of the liabilities of The Yanceyville,North Carolina branch and related CBCT of FirstSouth Bank, Burlington, NorthCarolina; (Control Number 96SE020039), (09/24/96)."
Corporate Decisions,96-54,/static/interpretations-and-precedents/oct/corpde54.pdf,"Application by Fleet National Bank, Springfield, Massachusetts, to operate amobile branch in Connecticut; (Control Number 96ML050108), (09/26/96)."
Corporate Decisions,96-55,/static/interpretations-and-precedents/oct/corpde55.pdf,"Conversion application of Douglass Bank into Douglass National Bank, KansasCity, Missouri; (Control Numbers 96MW0110019; 96MW120146, 96MW070033, 96MW050060,96MW060149 & 96MW120147), (09/27/96). "
Corporate Decisions,96-56,/static/interpretations-and-precedents/oct/corpde56.pdf,"Application to merge Leader Federal Bank for Savings, Memphis, Tennessee withand into Union Planters National Bank, Memphis, Tennessee, and operatebranches of Leader Federal Bank for Savings as branches of Union PlantersNational Bank; (Control Number 96SE020033), (09/30/96)."
Approvals with conditions enforceable under 12 U.S.C. 1818,96-57,/static/interpretations-and-precedents/oct/corpde57.pdf,"Application by Union Planters National Bank, Memphis, Tennessee, to purchasebranches, including the associated assets of Union Planters Bank of Mississippi,Grenada, Mississippi and Union Planters Bank of Northwest Mississippi,Clarksdale, Mississippi; (Control Number 96SE020035), (09/30/96)."
Approvals with conditions enforceable under 12 U.S.C. 1818,96-58,/static/interpretations-and-precedents/oct/corpde58.pdf,"Conversion Application of Connecticut River Bank, National Association,Charlestown, New Hampshire; (Control Numbers 96NE01012, 96NE12217, 96NE07025 &96NE0506),  (09/30/96)."
Approvals with conditions enforceable under 12 U.S.C. 1818,215,/static/interpretations-and-precedents/oct/conap215.pdf,"The Women's Bank, N.A., Denver, Colorado, of intent to establish an operatingsubsidiary pursuant to 12 C.F.R. 5.34 which will become a member of a limitedliability company.  (Control Number 96WE08005), 09/11/96"
Interpretive Letters,216,/static/interpretations-and-precedents/oct/conap216.pdf,"Texas Commerce Bank National Association, Houston, Texas, proposal toestablish a new operating subsidiary to invest in two limited liability corporations. (Control Number 96SW08009), 09/11/96"
Interpretive Letters,217,/static/interpretations-and-precedents/oct/conap217.pdf,"Kennett National Bank, Kennett, Missouri, proposal to establish a branch.  (ControlNumber 96MW050064), 09/26/96"
Interpretive Letters,218,/static/interpretations-and-precedents/oct/conap218.pdf,"Proposal from Union Planters National Bank, Memphis, Tennessee, to merge withLeader Federal Bank for Savings, Memphis, Tennessee, and purchase the assetsand assume the liabilities of four DeSoto County, Mississippi branches and twoCBCTs of Union Planters Bank of Mississippi, Grenada, Mississippi and oneDeSoto County, Mississippi branch of Union Planters Bank of NorthwestMississippi, Clarksdale, Mississippi.  (Control Numbers 96SE02033, 96SE02034 &96SE02035), 09/30/96"
Interpretive Letters,753,/static/interpretations-and-precedents/nov/int753.pdf,"Letter concludes that a national bank insurance agency located in a ""place of 5,000"" should be permitted the same marketing range and be able to use the same marketing tools and facilities available for licensed insurance agencies in the state where the bank agency operates. (11/04/96)"
Interpretive Letters,754,/static/interpretations-and-precedents/nov/int754.pdf,National bank operating subsidiary to provide investment portfolio management services for the bank and computer networking packages for other financial institutions. (11/06/96)
Interpretive Letters,755,/static/interpretations-and-precedents/nov/int755.pdf,"Letter permits a bank to retain an excess investment in FHLB stock ""where those purchases would facilitate plans, as documented in the bank's business plans or similar documents, to fund purchases of residential housing finance assets."" (10/03/96)"
Corporate Decisions,756,/static/interpretations-and-precedents/nov/int756.pdf,"Bank may purchase a minority interest in a limited liability company to be formed with an unaffiliated corporation to engage in the development, distribution and maintenance of computer software for cash management applications. (11/05/96)"
Corporate Decisions,96-59,/static/interpretations-and-precedents/nov/cd59.pdf,"Application to purchase the assets and assume the liabilities of the Hay Springs Branch of First National Bank of Chadron, Chadron, Nebraska by the Stockmens National Bank of Rushville, Rushville, Nebraska, under the charter of and title of the Stockmens National Bank of Rushville; (Control Number 96MW020022), (09/04/96)."
Corporate Decisions,96-60,/static/interpretations-and-precedents/nov/cd60.pdf,"Application to merge Chemical Bank FSB, Palm Beach, Florida, with and into the Chase Manhattan Private Bank (Florida) National Association, Tampa, Florida and Operate Branches of Chemical Bank FSB as branches of the Chase Manhattan Private Bank (Florida) (Control Number 96NE020032), (10/31/96)."
Corporate Decisions,96-61,/static/interpretations-and-precedents/nov/cd61.pdf,"Application from The First National Bank of Maryland, Baltimore, Maryland, to acquire The First National Bank of Maryland, D.C., Washington, District of Columbia; (Control Number 96NE020036), (11/06/96)."
Corporate Decisions,96-62,/static/interpretations-and-precedents/nov/cd62.pdf,"Application of Boatmen's National Bank of Oklahoma Tulsa, Oklahoma to Relocate a Branch to 2100 South Utica, City of Tulsa Tulsa County, Oklahoma (Control Number 96MW070022), (11/12/96)."
Corporate Decisions,96-63,/static/interpretations-and-precedents/nov/cd63.pdf,"Notification from Mellon Bank, National Association, Pittsburgh, Pennsylvania, to expand the activities of its operating subsidiary, Mellon Insurance Agency, Inc., to engage in certain general insurance agency activities (Control Number 96NE080013), (11/13/96)."
Corporate Decisions,219,/static/interpretations-and-precedents/nov/conda219.pdf,"Application by Chevron U.S.A. Inc., to charter a national CEBA credit card bank with the title ""Chevron Credit Bank, National Association, Murray City, Salt Lake County, Utah; (Control Number 96WE010004), (11/13/96)"
