Approvals with conditions enforceable under 12 U.S.C. 1818,98-48,/static/interpretations-and-precedents/nov98/cd98-48.pdf,"Application by National Bank of Commerce, Memphis, Tennessee, to expand theactivities of its subsidiary to include underwriting and dealing in, to a limited extent,securities of states and their political subdivision that do not qualify under the OCC'scurrent definitions as general obligation securities.  (Control Number 98WO080024),10/20/98"
Interpretive Letters,289,/static/interpretations-and-precedents/nov98/ca289.pdf,"Request of operating subsidiaries of various national banking associations to acquireownership interest in CheckFree Corporation through Integrion Financial Network,L.L.C.  (Control Numbers 98WO080006 through -0018 and -0021), 10/02/98"
Interpretive Letters,290,/static/interpretations-and-precedents/nov98/ca290.pdf,"Application to charter an uninsured national trust bank with the title ""King TrustCompany, National Association,"" Spring Arbor, Michigan.  (Control Number 98CE010006),10/22/98"
Corporate Decisions,291,/static/interpretations-and-precedents/nov98/ca291.pdf,"Application to charter an uninsured national trust bank with the title ""D.L. Moody TrustCompany, National Association,"" Chicago, Illinois (Proposed).  (Control Number98CE010007), 10/22/98"
Corporate Decisions,778,/static/interpretations-and-precedents/may97/int778.pdf,Proposal by a national bank to make a non-controlling investment in a limited liabilitycompany that will offer the placement of foreign currency time deposits with foreignbanks.     (03/20/97)
Corporate Decisions,779,/static/interpretations-and-precedents/may97/int779.pdf,Letter permits national banks to purchase for their own account interests in a privatelyoffered investment fund that would invest in high-yield loans.    (04/03/97)
Approvals with conditions enforceable under 12 U.S.C. 1818,780,/static/interpretations-and-precedents/may97/int780.pdf,"The Agencies concluded that investments in a trust that purchases state and local bondsto fund affordable housing, senior and congregate care-facilities, and educationalfacilities within their assessment areas: (1) may be considered to have invested withinits assessment area; (2) may receive favorable treatment under the investment test if: (a)the projects in which the proceeds of the Bonds are invested either are eligible for low-income housing tax credits or are qualified residential rental projects for purposes of 26U.S.C. 145 and 145; or (b) the primary purpose of the Bonds is to provide affordablehousing, senior congregate care, or educational services to low- and moderate-incomeindividuals; but (3) would not receive favorable consideration under the lending test.  (05/06/97)"
Approvals with conditions enforceable under 12 U.S.C. 1818,78,/static/interpretations-and-precedents/may97/cra78.pdf,"Application by City National Bank, Kilgore, Texas, to establish a branch.    (04/30/97)"
Approvals with conditions enforceable under 12 U.S.C. 1818,97-24,/static/interpretations-and-precedents/may97/cd97-24.pdf,"Notice of First National Bank Northwest Ohio, Bryan, Ohio, of its intent to acquire anoperating subsidiary to engage in insurance activities; (Control Number 97CEO080005),  (04/15/97). "
Corporate Decisions,97-25,/static/interpretations-and-precedents/may97/cd97-25.pdf,"Application of Texas National Bank, Sweetwater, Texas, to purchase the assets andassume the liabilities of the Sweetwater, Texas branch of State National Bank of WestTexas, Lubbock, Texas; (Control Number 97SWO20024),  (04/21/97). "
Corporate Decisions,97-26,/static/interpretations-and-precedents/may97/cd97-26.pdf,"Application by Wells Fargo Bank, N.A., San Francisco, California, to establishbranches; (Control Numbers 97ML050106 thru 0108),  (05/06/97)."
Corporate Decisions,97-27,/static/interpretations-and-precedents/may97/cd97-27.pdf,"Notification by Bank One, Columbus, N.A., Columbus, Ohio, of its intent to establishan operating subsidiary to reinsure mortgage insurance; (Control Number 97ML08008), (05/02/97)."
Approvals with conditions enforceable under 12 U.S.C. 1818,237,/static/interpretations-and-precedents/may97/ca237.pdf,"Notice from First Federal Savings and Loan Association of Wooster, Wooster, Ohio, toconvert to a national banking association, with the title of ""First Federal Bank, NationalAssociation"".  (Control Number 97CE010010),    04/14/97"
Approvals with conditions enforceable under 12 U.S.C. 1818,238,/static/interpretations-and-precedents/may97/ca238.pdf,"Application by Grand National Bank, Wauconda, Illinois to convert an Illinois charteredtrust bank subsidiary to be acquired by merger and establish it as a national trust bankoperating subsidiary with the title of ""Grand Premier Trust and Investment, Inc.,National Association,"" Freeport, Illinois.  (Control Number 97CE01015),  04/15/97"
Approvals with conditions enforceable under 12 U.S.C. 1818,239,/static/interpretations-and-precedents/may97/ca239.pdf,"Application to establish a national trust bank, FNC Trust Group, National Association,Boulder, Colorado.  (Control Number 97MW01005),  04/17/97"
Interpretive Letters,240,/static/interpretations-and-precedents/may97/ca240.pdf,"Application by City National Bank, Kilgore, Texas, to establish a domestic branch. (Control Number 97SW050016),   04/30/97"
Interpretive Letters,241,/static/interpretations-and-precedents/may97/ca241.pdf,"Application by First Union National Bank of North Carolina to establish an operatingsubsidiary organized as a limited liability company which will invest in a generalpartnership that will engage in mortgage banking activities.  (Control Number 97ML080005),  05/01/97"
Interpretive Letters,781,/static/interpretations-and-precedents/jun97/int781.pdf,"Letter finds that national banks may invest in money market preferred securities as TypeIII securities, so long as they meet the applicable rating and marketability requirementsof 12 C.F.R. Part 1.   (04/09/97)"
Interpretive Letters,782,/static/interpretations-and-precedents/jun97/int782.pdf,"Interstate bank may use branch state rates with respect to credit card loans where creditcard operations, prior to reorganization and following reorganization, were conducted inthat state.     (05/21/97)"
Interpretive Letters,783,/static/interpretations-and-precedents/jun97/cra783.pdf,Letter explains that financial institutions may receive positive consideration in theirCRA evaluations for their contributions to the small business loan fund itself and fortheir contributions to the loan fund's operating expenses.   (05/22/97)
Interpretive Letters,784,/static/interpretations-and-precedents/jun97/cra784.pdf,Letters states that financial institutions that purchase the equity-equivalent investmentswould not be able to have loans brokered by the organization considered under thelending test.   (05/30/97)
Interpretive Letters,785,/static/interpretations-and-precedents/jun97/int785.pdf,"A shared appreciation mortgage (""SAM"") loan is subject to the coverage of theAlternative Mortgage Transaction Parity Act of 1982, 12 U.S.C. 3801 et seq., andwithin the scope of the definition of an ""adjustable rate mortgage"" under the OCC'sregulations implementing the Parity Act at 12 C.F. Part 34 Subpart B.    (06/03/97)"
Interpretive Letters,97-02,/static/interpretations-and-precedents/jun97/nol97-02.pdf,No-objection to proposed remuneration disclosures by Bank for riskless principaltransactions in tax exempt municipal revenue bonds.   (05/12/97)
Corporate Decisions,97-28,/static/interpretations-and-precedents/jun97/cd97-28.pdf,"Application to merge First Security Bank of Oregon, Salem, Oregon, with and intoFirst Security Bank, National Association, Ogden, Utah; (Control Number 97WEO20010), (05/14/97). "
Corporate Decisions,97-29,/static/interpretations-and-precedents/jun97/cd97-29.pdf,"Application to merge U.S. Bank of California, Sacramento, California; U.S. Bank ofIdaho, Boise, Idaho; U.S. Bank of Nevada, Las Vegas, Nevada; U.S. Bank of Utah,Salt Lake City, Utah; and U.S. Bank of Washington, N.A., Seattle, Washington,with and into United States National Bank of Oregon, Portland, Oregon; (ControlNumber 97WE02011),  (05/19/97)."
Corporate Decisions,97-30,/static/interpretations-and-precedents/jun97/cd97-30.pdf,"Applications of BayBank NH, NA to relocate to Burlington, Massachusetts;establish a branch at the former main office, and merge with and into BayBank, NA,Boston, Massachusetts; (Control Numbers 96NE070012, 96NE050038, & 96NE020011), (05/19/97)."
Corporate Decisions,97-31,/static/interpretations-and-precedents/jun97/cd97-31.pdf,"Applications from The Miami County National Bank of Paola, Paola, Kansas torelocate its main office to Freeman, Missouri, and establish a branch at the formermain office location; (Control Numbers 97MW07007 & 97MW05043),   (05/31/97)."
Approvals with conditions enforceable under 12 U.S.C. 1818,97-32,/static/interpretations-and-precedents/jun97/cd97-32.pdf,"Applications by First Bank National Association, Minneapolis, Minnesota, toacquire First Bank, FSB, Fargo, North Dakota, and to engage in certain relatedtransactions; (Control Numbers 97MWO10006 & 0007, 97MW020009 - 0028, 97MW020030 &0031),   (05/31/97). "
Approvals with conditions enforceable under 12 U.S.C. 1818,97-33,/static/interpretations-and-precedents/jun97/cd97-33.pdf,"Applications of Bank One Wisconsin Trust Company, N.A., Milwaukee, Wisconsin,into Bank One Alpha Interim Trust Company, N.A., Milwaukee, Wisconsin, andBank One Trust Company, National Association, Columbus, Ohio; (Control Number97ML020005),  (06/01/97)."
Approvals with conditions enforceable under 12 U.S.C. 1818,97-34,/static/interpretations-and-precedents/jun97/cd97-34.pdf,"Applications of First of America - Florida, F.S.B., Tampa, Florida, First of AmericaBank - Indiana, Indianapolis, Indiana, and First of America Bank - Michigan, N.A.,Grand Rapids, Michigan; (Control Numbers 97CE010017 & 97CE020017),  (06/01/97)."
Interpretive Letters,97-35,/static/interpretations-and-precedents/jun97/cd97-35.pdf,"Application to merge Bank Midwest, Minnesota Iowa, N.A., Okoboji, Iowa, withand into Bank Midwest, Minnesota Iowa, N.A., Fairmont, Minnesota; (Control Number96MW020030),  (06/01/97)."
Interpretive Letters,97-36,/static/interpretations-and-precedents/jun97/cd97-36.pdf,"Application to merge Colorado National Bank, Denver, Colorado; ColoradoNational Bank Aspen, Aspen, Colorado; First Bank National Association, Chicago,Illinois, First Bank National Association, Omaha, Nebraska; First Bank of SouthDakota (National Association), Sioux Falls, South Dakota; First Bank (NationalAssociation), Milwaukee, Wisconsin; First Interim Bank of Des Moines, N.A., DesMoines, Iowa; and First Interim Bank of Casper, N.A., Casper, Wyoming, with andinto First Bank National Association, Minneapolis, Minnesota; (Control Number97MWO20029),  (06/01/97). "
Interpretive Letters,97-37,/static/interpretations-and-precedents/jun97/cd97-37.pdf,"Application to merge First Union National Bank of Georgia, Atlanta, Georgia, andFirst Union National Bank of Florida, Jacksonville, Florida, with and into FirstUnion National Bank of North Carolina, Charlotte, North Carolina; (Control Number97ML020006),  (06/01/97)."
Interpretive Letters,97-38,/static/interpretations-and-precedents/jun97/cd97-38.pdf,"Merger applications of KeyBank National Association, Anchorage, Alaska;KeyBank National Association, Fort Collins, Colorado; Key Trust Company ofFlorida, N.A., Naples, Florida; KeyBank National Association, Boise, Idaho;KeyBank National Association, Portland, Maine; KeyBank National Association,Bedford, New Hampshire; KeyBank National Association, Albany, New York;KeyBank National Association, Portland, Oregon; KeyBank National Association,Burlington, Vermont; KeyBank National Association, Tacoma, Washington(formerly Key Bank of Washington); KeyBank National Association, Tacoma,Washington (formerly Key Savings Bank); KeyBank National Association, SaltLake City, Utah; and KeyBank National Association, Cleveland, Ohio; (ControlNumber 97CE020018),   (06/01/97)."
Corporate Decisions,97-39,/static/interpretations-and-precedents/jun97/cd97-39.pdf,"Application to merge MetroBank-Illinois, National Association, East Moline,Illinois, with and into MetroBank, National Association, Davenport, Iowa; (ControlNumber 97CE020013),   (06/01/97)."
Corporate Decisions,97-40,/static/interpretations-and-precedents/jun97/cd97-40.pdf,"Application to merge NationsBank, National Association (South), Atlanta, Georgia,with and into NationsBank, National Association, Charlotte, North Carolina; (ControlNumber 97ML020007),  (06/01/97). "
Corporate Decisions,97-41,/static/interpretations-and-precedents/jun97/cd97-41.pdf,"Application to merge SouthTrust Bank of Russell County, Phenix City, Alabama;SouthTrust Bank of Florida, N.A., St. Petersburg, Florida; SouthTrust Bank ofNorthwest Florida, Marianna, Florida; SouthTrust Bank of Columbus, N.A.,Columbus, Georgia; SouthTrust Bank of Georgia, N.A., Atlanta, Georgia;SouthTrust Bank of South Mississippi, Biloxi, Mississippi; SouthTrust Bank ofNorth Carolina,Charlotte, North Carolina; SouthTrust Bank of South Carolina,N.A., Charleston, South Carolina; SouthTrust Bank of Tennessee, N.A., Nashville,Tennessee, with and into SouthTrust Bank of Alabama, N.A., Birmingham,Alabama; (Control Number 97SE020019),   (06/01/97)."
Approvals with conditions enforceable under 12 U.S.C. 1818,97-42,/static/interpretations-and-precedents/jun97/cd97-42.pdf,"Application to merge Wachovia Bank of South Carolina, N.A., Charleston, SouthCarolina, and Wachovia Bank of Georgia, N.A., Augusta, Georgia, with and intoWachovia Bank of North Carolina, N.A., Winston-Salem, North Carolina; (ControlNumber 97SE020011),  (06/01/97)."
Approvals with conditions enforceable under 12 U.S.C. 1818,97-43,/static/interpretations-and-precedents/jun97/cd97-43.pdf,"Application to merge Wells Fargo Bank (Colorado), N.A., Denver, Colorado, withand into Wells Fargo Bank, N.A., San Francisco, California; (Control Number97ML020011),  (06/01/97)."
Approvals with conditions enforceable under 12 U.S.C. 1818,97-44,/static/interpretations-and-precedents/jun97/cd97-44.pdf,"Application to merge Bank Calumet, National Association, Chicago Heights,Illinois, with and into Bank Calumet, National Association, Hammond, Indiana;(Control Number 97CE020026),  (06/03/97)."
Interpretive Letters,97-45,/static/interpretations-and-precedents/jun97/cd97-45.pdf,"Application to merge Deposit Guaranty National Bank of Louisiana, Hammond,Louisiana; Merchants National Bank, Fort Smith, Arkansas; Commercial NationalBank, Shreveport, Louisiana, with and into Deposit Guaranty National Bank,Jackson, Mississippi; (Control Number 97SE020015),  (06/04/97)."
Interpretive Letters,97-46,/static/interpretations-and-precedents/jun97/cd97-46.pdf,"Application to merge The Huntington National Bank of Florida, Maitland, Florida;The Huntington National Bank of Indiana, Noblesville, Indiana; HuntingtonNational Bank West Virginia, Charleston, West Virginia; Huntington Banks ofMichigan, Troy, Michigan; The Huntington Trust Company, N.A., Columbus, Ohio;and The Huntington Trust Company of Florida, N.A., Naples, Florida, with and intoThe Huntington National Bank, Columbus, Ohio; (Control Number 97CE020008),  (06/04/97)."
Interpretive Letters,97-47,/static/interpretations-and-precedents/jun97/cd97-47.pdf,"Applications to merge Boatmen's Bank of Vandalia, Vandalia, Missouri, andtwenty-two other affiliated banks with and into NationsBank, National Association,Charlotte, North Carolina; (Control Number 97ML02008 - 0009, & 0013),   (06/06/97)."
Interpretive Letters,242,/static/interpretations-and-precedents/jun97/ca242.pdf,"Notification by BankBoston, N.A., Boston, Massachusetts, that an existing operatingsubsidiary intends to perform a new activity.  (Control Number 97ML080009),  05/07/97"
Interpretive Letters,243,/static/interpretations-and-precedents/jun97/ca243.pdf,"Application of Chase Manhattan Bank USA, N.A., Wilmington, Delaware, toparticipate through one or more operating subsidiaries in joint ventures conductingresidential mortgage lending services.  (Control Number 97NE08013),  05/09/97"
Interpretive Letters,244,/static/interpretations-and-precedents/jun97/ca244.pdf,"Application by TTC Holdings, Inc. to charter a national trust bank with the title of""The Trust Company, National Association,"" San Antonio, Texas.  (Control Number96SW010021), 05/09/97"
Interpretive Letters,245,/static/interpretations-and-precedents/jun97/ca245.pdf,"Application of charter First Union Direct Bank, National Association, Augusta,Georgia, as an operating subsidiary of First Union National Bank of Georgia.  (ControlNumbers 97ML010001 & 97ML080002),   05/13/97"
Interpretive Letters,246,/static/interpretations-and-precedents/jun97/ca246.pdf,"Applications to merge U.S. Bank of California, Sacramento, California; U.S. Bank ofBoise, Idaho; U.S. Bank of Nevada, Las Vegas, Nevada; U.S. Bank of Utah, Salt LakeCity, Utah; and U.S. Bank of Washington, N.A., Seattle, Washington, with and intoUnited States National Bank of Oregon, Portland, Oregon; and to charter U.S. BankTrust Company, N.A., Portland, Oregon.  (Control Numbers 97WE010004 & 97WE020011),05/19/97"
Interpretive Letters,247,/static/interpretations-and-precedents/jun97/ca247.pdf,"Application by Mersco Finance Corporation to charter a national CEBA credit cardbank with the title ""Mercantile Stores National Bank,"" Baton Rouge, Louisiana. (Control Number 97SW010001),  05/27/97"
Interpretive Letters,786,/static/interpretations-and-precedents/jul97/int786.pdf,"Letter finds that national banks may elect corporate governance provisions of state law,and complete a reverse stock split in accordance with those provisions, provided statelaw provides reasonable dissenters' rights and bank has legitimate business purpose.   (06/09/97)"
Corporate Decisions,787,/static/interpretations-and-precedents/jul97/cra787.pdf,"Letter states that the meaning of ""qualified investment"" under the CRA regulationsincludes both ""direct"" and ""indirect"" investments.  (06/10/97)"
Corporate Decisions,788,/static/interpretations-and-precedents/jul97/int788.pdf,A national bank may not produce examination reports to a state court judge withoutOCC's approval.   (06/18/97)
Corporate Decisions,789,/static/interpretations-and-precedents/jul97/int789.pdf,State law prohibiting national banks from displaying their names on ATMs and givingstate regulatory authority over ATMs is preempted.    (06/27/97)
Corporate Decisions,790,/static/interpretations-and-precedents/jul97/int790.pdf,"Participation exception in lending limits regulation applies to the participation of a lineof credit on which draws may be made by the customer on consecutive days, providedthe participation funding is received by the lead bank by the end of  the next businessday after each advance to the customer is made.   (07/02/97)
"
Corporate Decisions,97-48,/static/interpretations-and-precedents/jul97/cd97-48.pdf,"Application for Lebanon Citizens National Bank, Lebanon, Ohio, to purchase certainassets and assume certain liabilities of three Ohio branch offices of KeyBank,National Association, Cleveland, Ohio; (Control Number 97CEO20027),  (06/12/97). "
Corporate Decisions,97-49,/static/interpretations-and-precedents/jul97/cd97-49.pdf,"Application by First National Bank of Pennsylvania, Greenville, Pennsylvania, toacquire a branch in Brookfield, Ohio, from The Metropolitan Savings Bank of Ohio,Youngstown, Ohio; (Control Number 97NE020019),  (06/19/97)."
Approvals with conditions enforceable under 12 U.S.C. 1818,97-50,/static/interpretations-and-precedents/jul97/cd97-50.pdf,"Application of Aurora National Bank, Aurora, Colorado to elect the corporategovernance provisions of Colorado law and complete a reverse stock split inaccordance with those provisions; (Control Number 97WE120132),  (06/20/97)."
Approvals with conditions enforceable under 12 U.S.C. 1818,97-51,/static/interpretations-and-precedents/jul97/cd97-51.pdf,"Application to merge Mercantile Bank of Illinois National Association, Hartford,Illinois, and Mark Twain Bank, Laude, Missouri, with and into Mercantile BankNational Association, St. Louis, Missouri; (Control Number 97MW020034),   (06/20/97)."
Approvals with conditions enforceable under 12 U.S.C. 1818,97-52,/static/interpretations-and-precedents/jul97/cd97-52.pdf,"Applications of Bank of America Trust Company of Florida, N.A., Boca Raton,Florida; Bank of America Florida Interim National Bank, Boca Raton, Florida; andBank of America National Trust & Savings Association, San Francisco, California;(Control Number 97MLO20017),  (06/25/97). "
Approvals with conditions enforceable under 12 U.S.C. 1818,97-53,/static/interpretations-and-precedents/jul97/cd97-53.pdf,"Application to merge Bank of America Illinois, Chicago, with and into Bank ofAmerica National Trust and Savings Association, San Francisco, California; (ControlNumber 97ML020001),  (06/25/97)."
Interpretive Letters,97-54,/static/interpretations-and-precedents/jul97/cd97-54.pdf,"Application of KeyBank National Association, Cleveland, Ohio, to acquire anoperating subsidiary which has invested in corporations, limited partnerships and ageneral partnership which engage in leasing activities; (Control Number 97CE08018), (06/26/97)."
No-Objection Letters,97-55,/static/interpretations-and-precedents/jul97/cd97-55.pdf,"Applications to merge First American National Bank of Kentucky, Bowling Green,Kentucky, with and into First American National Bank, Nashville, Tennessee, retainits branches and main office; (Control Number 97SE020020, 97SE050067 & 97SE050068, &97SE020029),  (06/26/97)."
Corporate Decisions,97-56,/static/interpretations-and-precedents/jul97/cd97-56.pdf,"Application by First National Community Bank, East Liverpool, Ohio, to acquire abranch in New Cumberland, West Virginia; (Control Number 97CEO20041),  (06/26/97). "
Corporate Decisions,97-57,/static/interpretations-and-precedents/jul97/cd97-57.pdf,"Application by Wells Fargo Bank, N.A., San Francisco, California, to establish abranch in Miramar, California; (Control Number 97ML050318),  (06/30/97)."
Corporate Decisions,97-58,/static/interpretations-and-precedents/jul97/cd97-58.pdf,"Application by Norwest Bank Nevada, F.S.B., Las Vegas, Nevada to convert to anational banking association under the title of Norwest Bank Nevada, NationalAssociation; (Control Number 97MW01013),  (06/30/97)."
Corporate Decisions,97-59,/static/interpretations-and-precedents/jul97/cd97-59.pdf,"Application to charter Banco de Prestamos National Bank, Queens, New York; (ControlNumber 96NE010020),  (07/07/97)."
Approvals with conditions enforceable under 12 U.S.C. 1818,97-60,/static/interpretations-and-precedents/jul97/cd97-60.pdf,"Application by Barnett Bank, National Association, Jacksonville, Florida, to expandthe activities of an existing, indirect operating subsidiary and thereby engage incertain Internet-based finder activities related to sales of pre-owned automobiles;(Control Number 97SE080024),   (07/01/97). "
Approvals with conditions enforceable under 12 U.S.C. 1818,248,/static/interpretations-and-precedents/jul97/ca248.pdf,"Notice of BankBoston, N.A., Boston, Massachusetts, to acquire and hold through an operating subsidiary 50 percent interest in a limited liability company engaging in creditcard and debit card transaction processing services to merchant businesses.  (ControlNumber 97ML080012),  06/27/97"
Interpretive Letters,249,/static/interpretations-and-precedents/jul97/ca249.pdf,"Application by Presbyterian Church (USA) Foundation to charter a national trust bankwith the title ""New Covenant Trust Company, National Association,"" Jeffersonville,Indiana.  (Control Number 97CE010023),  06/30/97"
Interpretive Letters,794 (rev),/static/interpretations-and-precedents/sep97/cra794.pdf,"Interagency CRA letter stating that an investment in an MBS bond that is specificallytailored to an institution's CRA requirements appears to be a ""qualified investment""under the CRA regulations. [footnote # 2 has been revised.] (08/11/97)"
Interpretive Letters,795,/static/interpretations-and-precedents/sep97/cra795.pdf,"Letter discusses whether examiners would favorably consider under CRA the activitiesof two community development corporations that the bank intends to form.  One CDCwould purchase equipment to be used by low- and moderate-income handicappedindividuals, primarily elementary and high school students and the other would beestablished to acquire real estate that would be leased to a social service agency for useas a transitional house for low- and moderate-income immigrants, dispossessedindividuals, families under stress, etc. (08/14/97)"
Interpretive Letters,796,/static/interpretations-and-precedents/sep97/int796.pdf,"Letter states that arrangement in which Bank A's customers may deliver deposits toBank B via independent messenger service for credit to their accounts in Bank A, andmake withdrawals in same manner, is a correspondent service, not branching. (08/05/97)"
Interpretive Letters,797,/static/interpretations-and-precedents/sep97/cra797.pdf,Letter provides broadly applicable guidance about how examiners would evaluate afinancial institution's investment in notes of a fund established to improve business andcommercial opportunity for economically disadvantaged individuals or business.   (09/02/97)
Interpretive Letters,798,/static/interpretations-and-precedents/sep97/cra798.pdf,"Letter states that if an unrated security is held, accounted for, and reported for CRApurposes by a financial institution as a loan or loan participation, the institution may haveit considered under the CRA regulations' lending test. (09/03/97)"
