Corporate Decisions,799,/static/interpretations-and-precedents/sep97/cra799.pdf,"Letter provides broad applicable guidance pertaining to the treatment under the CRAregulations of financial institutions' participation in funds, such as the one described,which would invest in certain businesses.  (09/03/97)"
Corporate Decisions,97-77,/static/interpretations-and-precedents/sep97/cd97-77.pdf,"Application to merge Stockmens Bank, National Association, Martins, South Dakota,into the Stockmens National Bank of Rushville, Rushville, Nebraska, under the charterof the latter and with the title of ""Stockmens National Bank;"" (Control Number97MWO20061), (09/04/97)."
Corporate Decisions,97-78,/static/interpretations-and-precedents/sep97/cd97-78.pdf,"Application of Zions First National Bank, Salt Lake City, Utah, to purchase certainassets and assume certain liabilities of the Coalville and Price branch offices, located inthe state of Utah, of Wells Fargo Bank, National Association, San Francisco, California;(Control Number  97WE020022), (07/02/97)."
Corporate Decisions,97-79,/static/interpretations-and-precedents/sep97/cd97-79.pdf,"Application of First Tennessee Bank, N.A. to establish a new operating subsidiarythrough the acquisition of Federal Flood Certification Corporation; (Control Number97SE080025), (07/11/97)."
Corporate Decisions,97-80,/static/interpretations-and-precedents/sep97/cd97-80.pdf,"Application for San Angelo National Bank, San Angelo, Texas to purchase certainassets and assume certain liabilities of Texas Commerce Bank, San Angelo, NationalAssociation, San Angelo, Texas, under the title and charter of San Angelo NationalBank; (Control Number  97SW020042), (07/31/97)."
Approvals with conditions enforceable under 12 U.S.C. 1818,97-81,/static/interpretations-and-precedents/sep97/cd97-81.pdf,"Application to merge Great Lakes National Bank Ohio, Hamilton, Ohio, with and intoGreat Lakes National Bank Michigan, Ann Arbor, Michigan, and a correspondingrequest from Great Lakes National Bank Ohio for a reduction in capital; (Control Number97MW020049), (08/13/97)."
Approvals with conditions enforceable under 12 U.S.C. 1818,97-82,/static/interpretations-and-precedents/sep97/cd97-82.pdf,"Application of Zions First National Bank, Salt Lake City, Utah, to purchase certainassets and assume certain liabilities of the Logan, North Lagan, Cedar City and St.George branch offices, located in the state of Utah, of Wells Fargo Bank, NationalAssociation, San Francisco, California; (Control Number  97WE020023), (09/03/97)."
Approvals with conditions enforceable under 12 U.S.C. 1818,97-83,/static/interpretations-and-precedents/sep97/cd97-83.pdf,"Application to relocate the Denair branch of Delta National Bank, Manteca, California,from Denair to Turlock, California; (Control Numbers 97WE070010), (09/03/97)."
Interpretive Letters,97-84,/static/interpretations-and-precedents/sep97/cd97-84.pdf,"Applications of First Western Bank, National Association, New Castle, Pennsylvania;(Control Numbers  97NE050133, 97SE020036, & 97SE020037), (09/05/97)."
Interpretive Letters,253,/static/interpretations-and-precedents/sep97/ca253.pdf,"Application to charter Compubank, National Association, Houston, Texas.  (ControlNumber 96WO010003), 08/20/97"
Interpretive Letters,254,/static/interpretations-and-precedents/sep97/ca254.pdf,"Application of Citibank, N.A., New York, New York to establish an operating subsidiaryto invest in and become a member of MECA Software, L.L.C.   (Control Number97ML080016), 08/21/97"
Interpretive Letters,800,/static/interpretations-and-precedents/oct97/cra800.pdf,"Interagency CRA interpretive letter addressing three issues in connection with financialinstitutions' investments in pooled national community development funds.  The issuesare: (1) Whether the CRA regulations treat an institution's investment differentlyaccording to whether the institution invests directly in a project or indirectly, such asthrough a national fund; (2) When and how examiners consider such an investment in anational fund by an institution; and (3) How the CRA regulations define ""region"" forpurposes of evaluating a wholesale or limited purpose institution's performance underthe community development test. (09/11/97)"
Corporate Decisions,801,/static/interpretations-and-precedents/oct97/int801.pdf,Interagency CRA staff interpretive letter addressing two issues: (1) Whether the timingof payments of a qualified investment will affect the amount of consideration received;and (2) How examiners will evaluate an institution's qualified investments in apartnership with nationwide investments. (08/11/97)
Corporate Decisions,802,/static/interpretations-and-precedents/oct97/cra802.pdf,Letter states that a financial institution's activities in connection with a program offeringa financial services education curriculum for high school students would receivefavorable CRA consideration if the students participating in the course were low- andmoderate- income. (09/17/97)
Corporate Decisions,803,/static/interpretations-and-precedents/oct97/int803.pdf,Letter opines on whether certain fees are interest under 12 U.S.C. 85 and 12 CFR7.4001(a). (9/07/97)
Corporate Decisions,97-85,/static/interpretations-and-precedents/oct97/cd97-85.pdf,"Applications by Wells Fargo Bank, N.A. to establish branches at various locations;(Control Numbers 97ML050372 & 97ML050377 thru 0393), (08/22/97)."
Corporate Decisions,97-86,/static/interpretations-and-precedents/oct97/cd97-86.pdf,"Applications to merge Matewan National Bank/Kentucky, Pikeville, Kentucky withand into Matewan National Bank, Matewan, West Virginia, and to establish fivebranches in Virginia; (Control Numbers 97SE020041 & 97SE050170 thru 0174), (09/12/97)."
Corporate Decisions,97-87,/static/interpretations-and-precedents/oct97/cd97-87.pdf,"Application by Vermont National Bank, Brattleboro, Vermont, to combine with itsaffiliate, Vermont Federal Bank, Federal Savings Bank; (Control Numbers 97NE020031 &0032, 97NE010015, & 97NE050132), (09/13/97)."
Corporate Decisions,97-88,/static/interpretations-and-precedents/oct97/cd97-88.pdf,"Application to merge fifteen Michigan state bank affiliates with and into TheHuntington National Bank, Columbus, Ohio; (Control Number  97CE020053), (09/15/97)."
Corporate Decisions,97-89,/static/interpretations-and-precedents/oct97/cd97-89.pdf,"Notification by Norwest Bank Minnesota, N.A., Minneapolis, Minnesota, of itsintent to establish an operating subsidiary to reinsure mortgage insurance; (ControlNumber 97MW08022), (09/26/97)."
Approvals with conditions enforceable under 12 U.S.C. 1818,97-90,/static/interpretations-and-precedents/oct97/cd97-90.pdf,"Applications to establish Stephenson National Bank (SNB) and to merge SNB withand into The Stephenson National Bank and Trust, Marinette, Wisconsin, under thecharter of the latter; (Control Numbers  97CE010030 & 97CE020067), (10/03/97)."
Approvals with conditions enforceable under 12 U.S.C. 1818,255,/static/interpretations-and-precedents/oct97/ca255.pdf,"Application of First National Bank of Omaha, Omaha, NE, for an existing operatingsubsidiary to purchase a non-controlling minority interest in Data ProcessorsInternational, Inc., a merchant processing corporation.  (Control Number 97MW080036),09/25/97"
Interpretive Letters,256,/static/interpretations-and-precedents/oct97/ca256.pdf,"Application to charter State Street Global Advisors, National Association, Naples,Florida, as an operating subsidiary of State Street Bank and Trust Company, Boston,Massachusetts.   (Control Number 97NE01018), 09/30/97"
Interpretive Letters,257,/static/interpretations-and-precedents/oct97/ca257.pdf,"Application by IBAA Bancard, Inc. to charter a national CEBA credit card bank with thetitle of ""TCM Bank, National Association.""  (Control Number 97SE0101128),09/30/97"
Interpretive Letters,804,/static/interpretations-and-precedents/nov97/int804.pdf,Bank may pay retail commissions for mutual funds sold under a back-end loanstructure and receive 12b-1 fees and contingent deterred sales charges ascompensation.   (09/30/97)
CRA Decisions,805,/static/interpretations-and-precedents/nov97/int805.pdf,"Letter concludes that the ""business of banking"" includes 1) electronic imaging servicesfor other banks and financial institutions and 2)electronic imaging services for non-banks if limited tofinancial data and documents.   (10/09/97)"
Corporate Decisions,97-91,/static/interpretations-and-precedents/nov97/cd97-91.pdf,"Application to merge Bank of Boston Connecticut, Hartford, Connecticut, intoBankBoston, N.A., Boston, Massachusetts; (Control Numbers 97ML020028),  (10/14/97)."
Corporate Decisions,97-92,/static/interpretations-and-precedents/nov97/cd97-92.pdf,"Notification by Bank of America, NT&SA, San Francisco, California, of its intent toacquire General Fidelity Insurance Company;(Control Number 97ML08010), (10/17/97)."
Corporate Decisions,97-93,/static/interpretations-and-precedents/nov97/cd97-93.pdf,"Notification by SunTrust Bank, Nashville, N.A., Nashville, Tennessee, of its intent toestablish an operating subsidiary to reinsure mortgage insurance; (Control Number97SE080029), (10/20/97)."
Corporate Decisions,97-94,/static/interpretations-and-precedents/nov97/cd97-94.pdf,"Proposal by Chase Manhattan Bank USA, National Association, Wilmington,Delaware, to purchase and assume certain deposit liabilities of The Chase ManhattanBank, New York, New York; (Control Number  97NE020039), (10/22/97)."
Approvals with conditions enforceable under 12 U.S.C. 1818,97-95,/static/interpretations-and-precedents/nov97/cd97-95.pdf,"Application of Hamilton Bank, N.A., Miami, Florida, to establish a branch in SanJuan Puerto Rico; (Control Number 97SE050196), (10/30/97)."
Approvals with conditions enforceable under 12 U.S.C. 1818,97-96,/static/interpretations-and-precedents/nov97/cd97-96.pdf,"Application to merge Signet Bank, Richmond, Virginia, with and into First UnionNational Bank, Charlotte, North Carolina;(Control Number  97ML020029), (11/09/97)."
Approvals with conditions enforceable under 12 U.S.C. 1818,97-97,/static/interpretations-and-precedents/nov97/cd97-97.pdf,"Notification by First Tennessee Bank, N.A., Memphis, Tennessee, of its intent toestablish an operating subsidiary to reinsure mortgage insurance; (Control Number 97SE080035),  (11/10/97)."
Approvals with conditions enforceable under 12 U.S.C. 1818,258,/static/interpretations-and-precedents/nov97/ca258.pdf,"Application by The CATO Corporation to charter a national CEBA credit card bankwith the title ""Cedar Hill National Bank,"" Lawrenceville, Georgia.  (Control Number97SE010002),  10/27/97"
Approvals with conditions enforceable under 12 U.S.C. 1818,259,/static/interpretations-and-precedents/nov97/ca259.pdf,"Union Planters National Bank, Memphis, Tennessee, proposed acquisition of anoperating subsidiary, Magna Insurance Company.   (Control Number 97SE080033), 10/31/97"
Interpretive Letters,719,None,"Letter concludes that an ESOP is a ""company' for purposes of 12 U.S.C. 371c andthat an ESOP that controls at least 25% of a bank's voting stock is an ""affiliate""under sec. 371c (supersedes existing OCC interpretive letter #261).  (10/26/89)"
Interpretive Letters,720,/static/interpretations-and-precedents/may/int720.pdf,"Group of affiliate national banks may collectively own, through operatingsubsidiaries, minority interest in a merchant credit card processing subsidiary.(01/26/96)"
Interpretive Letters,721,/static/interpretations-and-precedents/may/int721.pdf,Letter discusses the use of an affiliated bank to originate and close consumer loans. (03/06/96)
Interpretive Letters,722,/static/interpretations-and-precedents/may/int722.pdf,"A national bank may invest CIF assets in mutual funds, including mutual funds thatpay the bank a servicing fee, without the bank having to reduce its trustee fees, if thebank concludes, based upon a reasoned opinion of trust counsel, that such anarrangement is authorized by applicable state law, is consistent with the trustinstrument, is appropriate for the particular trust accounts, and is consistent withOCC regulations, including in particular 12 C.F.R. 9.18(b)(12).    (03/12/96)"
Interpretive Letters,723,/static/interpretations-and-precedents/may/cra723.pdf,Letter discusses the application of CRA to a bank's purchases of debentures issued by aspecialized small business investment company.    (04/15/96)
No-Objection Letters,724,/static/interpretations-and-precedents/may/int724.pdf,"Bank can sell vehicle service contracts to customers who use home equity loan proceedsto purchase a vehicle, and the maturity of the service contract may be different from thematurity of the loan.    (04/22/96)  "
Corporate Decisions,725,/static/interpretations-and-precedents/may/int725.pdf,National bank to establish an operating subsidiary to engage in permissible derivatives-related activities.  (05/10/96)
Corporate Decisions,96-20,None,"Application to merge Fleet Bank of New York, National Association, Schenectady,New York, with and into NatWest Bank National Association, Jersey City, NewJersey, under the charter of the latter and with the title, Fleet Bank, NationalAssociation; (Control Number 96ML020004), (04/12/96). "
Corporate Decisions,96-21,None,"Application of Franklin National Bank of Virginia, Alexandria, Virginia, to establisha branch in Bethesda, Maryland; (Control Number 96SE05028), (04/15/96)."
Corporate Decisions,96-22,None,"Applications of Community National Bank, South Boston, Virginia, to establish abranch in Henderson, North Carolina, and to establish a branch in Louisburg, NorthCarolina; (Control Numbers 96SE050027 & 96SE050028), (04/19/96)."
Corporate Decisions,200,None,"NatWest Bank National Association, Jersey City, NJ, notification to acquire threesubsidiaries from its holding company and to establish a fourth subsidiary to takeover certain additional activities now conducted in an affiliate.  (Control Numbers96ML08004 through 007), 04/12/96"
Corporate Decisions,201,None,"First Financial Services Group, National Association, Zanesville, OH, application fora new bank charter limited to fiduciary powers.  (Control Number 96CE01015),04/24/96"
Corporate Decisions,202,None,"Barnett Bank of Jacksonville, N.A., Jacksonville, FL, operating subsidiarynotification.  (Control Number 96SE080002), 04/25/96"
Corporate Decisions, 96-23,/static/interpretations-and-precedents/june/corpde23.pdf," Applications from The Palmer National Bank, Washington, D.C., to relocate itsmain office to Bethesda, Maryland, and to establish a branch at the former mainoffice location.   (Control Numbers 96NE070014 & 96NE050042), (05/02/96)."
Corporate Decisions, 96-24,/static/interpretations-and-precedents/june/corpde24.pdf,"Applications from MidAmerica Bank, National Association, Moline, Illinois torelocate its head office to Davenport, Iowa, establish a branch at its former headoffice site, and to retain the Cairo, Illinois branch site.  (Control Numbers 96CE070004 & 96CE050040), (05/06/96)."
Corporate Decisions, 96-25,/static/interpretations-and-precedents/june/corpde25.pdf,"Application to purchase the assets and assume the liabilities of the ""InternationalFalls branch"" of Inter Savings Bank, fsb, Bloomington, Minnesota, by NorthernNational Bank, International Falls, Minnesota, under the charter and title ofNorthern National Bank.   (Control Numbers 96MW020010), (05/16/96)."
Corporate Decisions, 96-26,/static/interpretations-and-precedents/june/corpde26.pdf,"Application to purchase the assets and assume the liabilities of the Greenfield, Iowabranch of Boatmen's Bank Iowa, National Association, Des Moines, Iowa, by FirstNational Bank, Fontanelle, Iowa, under the charter and title of First National Bank,Fontanelle, Iowa.  (Control Number 96MW020009), (05/16/96). "
Corporate Decisions, 96-27,/static/interpretations-and-precedents/june/corpde27.pdf,"Application of First Union National Bank, Elkton, Maryland, to relocate its mainoffice to Avondale, Pennsylvania.   (Control Number 96ML070011), (05/20/96)."
Corporate Decisions, 96-28,/static/interpretations-and-precedents/june/corpde28.pdf,"Application to merge Republic Bank California, National Association, BeverlyHills, California, with and into Republic National Bank of New York, New York,New York.   (Control Number 96NE020017), (05/20/96)."
Corporate Decisions, 96-29,/static/interpretations-and-precedents/june/corpde29.pdf,"Applications to merge First Interstate Bank of Alaska, N.A., Anchorage, Alaska,First Interstate Bank of Idaho, N.A., Boise, Idaho, First Interstate Bank of Nevada,N.A., Las Vegas, Nevada, First Interstate Bank of New Mexico, Santa Fe, NewMexico, First Interstate Bank of Oregon, N.A., Portland, Oregon, and FirstInterstate Bank of Utah, N.A., Salt Lake City, Utah, with and into Wells FargoBank, N.A., San Francisco, California.   (Control Numbers 96ML020015, & 96ML020018through 0022), (06/01/96)."
Corporate Decisions, 96-30,/static/interpretations-and-precedents/june/corpde30.pdf,"Application to merge First Interstate Bank of Washington, N.A., Seattle,Washington, with and into Wells Fargo Bank, N.A., San Francisco, California.   (Control Number 96ML020023), (06/06/96). "
Corporate Decisions, 96-31,/static/interpretations-and-precedents/june/corpde31.pdf,"Application to merge First Security Bank of Idaho, N.A., Boise, Idaho, with andinto First Security Bank of Utah, N.A., Ogden, Utah, under the charter of the latterand with the title First Security Bank, National Association.   (Control Number 96WE020010), (06/12/96)."
Corporate Decisions, 96-32,/static/interpretations-and-precedents/june/corpde32.pdf,"Applications of KeyBank, National Association, Angola, Indiana to change itslocation to Bryan, Ohio, establish a branch at the former head office site, and tomerge with and into Society National Bank, Cleveland, Ohio, under the charter ofSociety and with the title of KeyBank, National Association.   (Control Numbers 96CE070001, 96CE050027, & 96CE020008), (06/14/96)."
Corporate Decisions, 203,/static/interpretations-and-precedents/june/conap203.pdf," NationsBank, N.A., Charlotte North Carolina, notification to establish an operatingsubsidiary to engage in certain derivatives activities.   (Control Number 96WO80005), (05/10/96). 

"
Corporate Decisions, 204,/static/interpretations-and-precedents/june/conap204.pdf," Application to merge Meridian Bank, Reading, Pennsylvania, with and intoCoreStates Bank, National Association, Philadelphia, Pennsylvania, under thecharter and title of the latter.  (Control Number 96NE020014), (05/15/96). "
Corporate Decisions,  709(Rev),/static/interpretations-and-precedents/july/cra709re.pdf," Letter opines that, in its CRA evaluation, an institution that invests in a communitydevelopment bank may have its investment considered under the regulation'sinvestment test, or it may choose to have a portion of its investment evaluated underthe lending test and the remainder evaluated under the investment test (ReplacesInterpretive Letter #709 in its entirety).    (06/14/96)."
Approvals with conditions enforceable under 12 U.S.C. 1818, 726,/static/interpretations-and-precedents/july/cra726.pdf, Letter concerns the application of the Community Reinvestment Act (CRA)regulations to financial institutions' support of microenterprise lending programs.  (06/21/96).
Approvals with conditions enforceable under 12 U.S.C. 1818,  727 ,/static/interpretations-and-precedents/july/cra727.pdf," Letter concerns treatment under the revised CRA regulations of the proposedpurchase of ""equity equivalent"" instruments to be offered by a non-profitcommunity development lender.   (06/26/96)."
Approvals with conditions enforceable under 12 U.S.C. 1818,  728,/static/interpretations-and-precedents/july/cra728.pdf," Letter concerns the treatment under the revised CRA regulations of the ""DirectDeposit Too (DD Too)"" program the Financial Management Service (FMS) hopesto develop to expand direct deposit, especially to recipients of federal payments whodo not presently have deposit accounts.   (06/18/96)."
Approvals with conditions enforceable under 12 U.S.C. 1818,  729,/static/interpretations-and-precedents/july/cra729.pdf," Letter discusses how an institution should collect and, if appropriate, report thelocation of small business and consumer loans, for CRA purposes, when the loansare made to borrowers with addresses consisting of post office box numbers or ruralroute and box numbers.   (06/14/96)."
Approvals with conditions enforceable under 12 U.S.C. 1818,  730,/static/interpretations-and-precedents/july/int730.pdf, Letter concludes that loans proposed by the bank to an unaffiliated distributor ofmutual funds would not be subject to interaffiliate lending restrictions contained in12 U.S.C. 371C.   (05/29/96).          
Approvals with conditions enforceable under 12 U.S.C. 1818,  731,/static/interpretations-and-precedents/july/int731.pdf," Letter concludes that it is legally permissible part of the business of banking under24(Seventh) for a national bank and its operating subsidiary to bid to design,implement and operate a processing center and facilities for electronic tollcollection.   (07/01/96)."
Interpretive Letters,  732,/static/interpretations-and-precedents/july/int732.pdf," National bank may make a 5.5% investment in software company which is engagedin the design, development, marketing and maintenance of a network for electronicfunds transfers and electronic data interchange, including transacting electroniccommerce and marketing software products for use on its world-wide electroniccommerce network.   (05/10/96).          "
Interpretive Letters,  733,/static/interpretations-and-precedents/july/int733.pdf," National bank receiver is subject to the rights of secured creditors and creditorsentitled to setoff.  U.S. legal principles regarding enforcement of security interestsare applicable to a receivership of a federal branch or agency conducted underNational Bank Act.  Therefore, receiver of an uninsured federal branch or agencydoes not have the right to interfere with the rights of secured creditors, includingapplication of collateral held in U.S. to obligations of a non-U.S. office of the bank. (06/19/96). "
Interpretive Letters,  96-33,/static/interpretations-and-precedents/july/corpde33.pdf," Application for Star Bank, National Association, Indiana, Richmond, Indiana, topurchase the assets and assume the liabilities of five Connersville, Indiana branchoffices of National City Bank of Indiana, Indianapolis, Indiana, under the charterand title of Star Bank, National Association, Indiana.   (Control Number 96CE020020),(06/20/96)."
Interpretive Letters,  96-34,/static/interpretations-and-precedents/july/corpde34.pdf," Application of NationsBank of Texas, National Association, Dallas, Texas, topurchase certain of the assets and assume certain of the liabilities of BlueBonnetSavings Bank FSB, Dallas, Texas.   (Control Number 96ML020031), (06/24/96)."
Interpretive Letters,  96-35,/static/interpretations-and-precedents/july/corpde35.pdf,"Application to merge Bank of America Oregon, Portland, Oregon, with and intoBank of America National Trust and Savings Association, San Francisco,California, under the charter and title of Bank of America National Trust andSavings Association.   (Control Number 96ML020027), (06/26/96). "
Corporate Decisions,  96-36,/static/interpretations-and-precedents/july/corpde36.pdf," Application to merge BankAmerica National Trust Company, New York, NewYork, with and into Bank of America National Trust and Savings Association, SanFrancisco, California.   (Control Number 96ML020026), (07/09/96)."
Corporate Decisions,  96-37,/static/interpretations-and-precedents/july/corpde37.pdf," Applications to charter TCF Bank Minnesota, N.A., Minneapolis, Minnesota, TCFBank Illinois, N.A., Oak Brook, Illinois, TCF Bank Wisconsin, N.A., Milwaukee,Wisconsin, and Great lakes Bank Michigan, N.A., Ann Arbor, Michigan.   (ControlNumbers 96MW01005 thru 0008), (07/18/96). "
Corporate Decisions,  205,/static/interpretations-and-precedents/july/conap205.pdf," First Financial Bank, F.S.B. to charter a national CEBA credit card bank with thetitle ""First Financial Card Services Bank, National Association,"" Stevens Point,Wisconsin.   (Control Number 96CE010022), 07/02/96."
Corporate Decisions,  206,/static/interpretations-and-precedents/july/conap206.pdf," First Citizens Bank, National Association, Michigan City, Indiana, to charter a trustbank subsidiary with the title of Horizon Investment Management, NationalAssociation, Michigan City, Indiana.    (Control Number 96CE01023), 06/18/96."
Corporate Decisions,  207 ,/static/interpretations-and-precedents/july/conap207.pdf," Notice of intent of Wood County Trust Company, Wisconsin Rapids, Wisconsin toconvert to a national trust bank and exercise fiduciary powers with the title of""Wood County Trust Company, National Association.""    (Control Number 96CE01020),06/18/96. "
Corporate Decisions,737,/static/interpretations-and-precedents/sept/int737.pdf,Huntington National Bank's acquisition of minority interest in a limited liabilitycompany providing stored value systems.  (08/19/96)
Corporate Decisions,738,/static/interpretations-and-precedents/sept/int738.pdf,National bank's participation in a guaranty issued by an agent for a syndication oflenders with respect to their borrower's letter of credit reimbursement obligations toanother bank or financial institution is permissible under I.R. 7.1016.  (08/14/96)
Corporate Decisions,739,/static/interpretations-and-precedents/sept/int739.pdf,"Letter authorizes bank to engage in their proposed insurance activities, to the extentpermissible under 12 U.S.C. 92. (08/15/96)"
